{
  "kernel_version":"2.0.0",
  "controller_version":"2.0.0",
  "eos_version":"1.2.0",
  "commit":"d831ce4",
  "delivery_environment":"generic-agent",
  "activation_tier":"T2",
  "activation_state":"INSTRUCTED",
  "initialization_verdict":"PASS",
  "authorities_loaded":[{"id":"SOURCE_OF_TRUTH","state":"Verified"},{"id":"Elite Build Goals","state":"Verified"}],
  "capability_resolution":[{"id":"project-bootstrap","applicable":true,"ceiling":"Full"},{"id":"external-deployment","applicable":false,"ceiling":"Unsupported"}],
  "skills_loaded":["project-bootstrap-and-setup","long-horizon-agent-runtime"],
  "audits_selected":["schema-enforcement"],
  "templates_selected":["DESIGN_SPEC_TEMPLATE"],
  "gates_required":["A","B"],
  "elite_goal_status":[{"goal_id":"META-0","evidence_state":"Verified"},{"goal_id":"1-16","evidence_state":"Verified"}],
  "degradations":[],
  "unresolved_blockers":[],
  "rehydration_set":[".wcbs/project-profile.json",".wcbs/capability-resolution.json",".wcbs/engineering-team.json",".wcbs/elite-goals-ledger.json",".wcbs/risk-register.json",".wcbs/release-state.json",".wcbs/evidence-ledger.jsonl"],
  "canonicalization_version":"1",
  "inputs":[{"id":"project_request","mandatory":true,"state":"Verified"},{"id":"governance","mandatory":true,"state":"Verified"},{"id":"preflight","mandatory":true,"state":"Verified"}],
  "content_hash":"0000000000000000000000000000000000000000000000000000000000000000",
  "issued_at":"2026-07-27T15:04:00Z"
}
